{
  "id": "algerie-poste",
  "displayName": "Algérie Poste",
  "aliases": [
    "Algeria Post",
    "Algerie Poste",
    "EMS Champion Post Algérie",
    "EMS Champion Post Algeria"
  ],
  "region": {
    "countries": [
      "DZ"
    ]
  },
  "brand": {
    "color": "#213f98"
  },
  "selectable": true,
  "timezone": "Africa/Algiers",
  "tracking": {
    "mode": "automatic",
    "adapter": "universal",
    "steps": []
  },
  "capabilities": [],
  "portal": {
    "url": "https://ems.dz/track/index.php?icd={trackingNumber}",
    "searchUrl": "https://www.ems.dz/",
    "canaryUrl": "https://www.ems.dz/",
    "shows": [],
    "scraped": [],
    "discarded": [],
    "unavailable": []
  },
  "links": [
    {
      "domains": [
        "ems.dz",
        "www.ems.dz"
      ],
      "pathPattern": "^/track/index\\.php$",
      "params": [
        "icd"
      ]
    },
    {
      "domains": [
        "track.ems.dz"
      ],
      "pathPattern": "^/track\\.php$",
      "params": [
        "icd"
      ]
    }
  ],
  "detection": [
    {
      "id": "algerie-poste-1",
      "pattern": "^E[CD]\\d{11}$",
      "confidence": "low"
    }
  ]
}
