{
  "id": "la-poste-senegal",
  "displayName": "La Poste du Sénégal",
  "aliases": [
    "La Poste Sénégal",
    "La Poste Senegal",
    "Poste du Sénégal",
    "Senegal Post",
    "Jotnaci"
  ],
  "region": {
    "countries": [
      "SN"
    ]
  },
  "brand": {
    "color": "#1b5cab"
  },
  "selectable": true,
  "timezone": "Africa/Dakar",
  "tracking": {
    "mode": "automatic",
    "adapter": "la-poste-senegal",
    "steps": [
      "direct",
      "retry"
    ],
    "recognition": {
      "rank": 892
    },
    "localClocks": true
  },
  "capabilities": [
    "history",
    "location",
    "provider_code",
    "destination_country"
  ],
  "portal": {
    "searchUrl": "https://www.laposte.sn/",
    "canaryUrl": "https://www.laposte.sn/",
    "shows": [
      "history",
      "location"
    ],
    "scraped": [
      "status",
      "history",
      "location",
      "provider_code",
      "destination_country",
      "event_details"
    ],
    "discarded": [],
    "unavailable": [
      "eta",
      "weight",
      "service_name",
      "sender_name",
      "recipient_name",
      "offset_timestamps",
      "delivered_at",
      "delivery_tracking_number"
    ]
  },
  "links": [],
  "detection": [
    {
      "id": "la-poste-senegal-s10",
      "pattern": "^[A-Z]{2}\\d{9}SN$",
      "confidence": "low",
      "checksum": "s10",
      "preferred": true
    }
  ]
}
