{
  "id": "intl-post",
  "displayName": "Unknown postal carrier",
  "displayNames": {
    "en": "Unknown postal carrier",
    "de": "Postanbieter unbekannt",
    "fr": "Transporteur postal inconnu",
    "it": "Corriere postale sconosciuto",
    "es": "Operador postal desconocido",
    "pt": "Operador postal desconhecido",
    "pl": "Nieznany operator pocztowy"
  },
  "aliases": [],
  "region": {
    "countries": []
  },
  "brand": {
    "color": "#2c6fb5"
  },
  "selectable": false,
  "timezone": "UTC",
  "tracking": {
    "mode": "automatic",
    "adapter": "universal",
    "steps": []
  },
  "capabilities": [],
  "portal": {
    "url": "https://t.17track.net/en#nums={trackingNumber}",
    "searchUrl": "https://t.17track.net/en",
    "siteName": "17TRACK",
    "canaryUrl": "https://parcelsapp.com/en",
    "shows": [],
    "scraped": [],
    "discarded": [],
    "unavailable": []
  },
  "links": [],
  "detection": [
    {
      "id": "intl-post-2",
      "pattern": "^(?![CLR][A-Z]\\d{9}DE$)(?![CELR][A-Z]\\d{9}TW$)(?![CEL][A-Z]\\d{9}AU$)(?![CELR][A-Z]\\d{9}SK$)(?![CELR][A-Z]\\d{9}HR$)(?![CELR][A-Z]\\d{9}LV$)(?!AS\\d{9}US$)(?![CELR][A-Z]\\d{9}IT$)(?!(?:PZ|XR|XT|XU|XW|XY))[A-Z]{2}\\d{9}(?!CA$|CH$|FR$|IN$|NL$|GB$|IE$|BE$|PT$|NZ$|SG$|JP$|KR$|TH$|HK$|MY$|CN$|NO$|BR$|ES$|SE$|DK$|AT$|YP$|TS$|JF$|JB$|RV$|VF$|TY$|MI$|XX$|MH$|YW$|CS$|EN$|CL$)[A-Z]{2}$",
      "confidence": "high",
      "checksum": "s10"
    }
  ]
}
