{
  "id": "tipsa",
  "displayName": "TIPSA",
  "aliases": [],
  "region": {
    "countries": [
      "ES",
      "PT",
      "AD"
    ]
  },
  "brand": {
    "color": "#001e62"
  },
  "selectable": true,
  "timezone": "Europe/Madrid",
  "tracking": {
    "mode": "automatic",
    "adapter": "tipsa",
    "steps": [
      "direct"
    ],
    "recognition": {
      "rank": 680,
      "pattern": "^\\d{22}$"
    }
  },
  "capabilities": [
    "history",
    "location",
    "sender_name",
    "weight"
  ],
  "portal": {
    "url": "https://www.tip-sa.com/cliente/datos_env.php?id={trackingNumber}",
    "searchUrl": "https://www.tip-sa.com/es/localizacion-envios",
    "canaryUrl": "https://dinapaqweb.tipsa-dinapaq.com/dinapaqweb/detalle_envio.php",
    "shows": [
      "status",
      "history",
      "location",
      "sender_name",
      "recipient_name",
      "recipient_address",
      "postcodes",
      "customer_reference",
      "parcel_count",
      "weight",
      "volume",
      "proof_of_delivery"
    ],
    "scraped": [
      "status",
      "history",
      "location",
      "sender_name",
      "weight"
    ],
    "discarded": [
      "recipient_name",
      "recipient_address",
      "postcodes",
      "customer_reference",
      "parcel_count",
      "volume",
      "proof_of_delivery"
    ],
    "unavailable": [
      "eta"
    ]
  },
  "links": [
    {
      "domains": [
        "tip-sa.com"
      ],
      "pathPattern": "^/(?:$|cliente/datos(?:_prestashop|_env)?\\.php$)",
      "params": [
        "id"
      ]
    }
  ],
  "detection": [
    {
      "id": "tipsa-1",
      "pattern": "^\\d{10}$",
      "confidence": "low"
    },
    {
      "id": "tipsa-2",
      "pattern": "^0\\d{5}0\\d{5}\\d{10}$",
      "confidence": "low",
      "preferred": true
    }
  ]
}
