{
  "id": "tws-express",
  "displayName": "TWS Express Courier",
  "aliases": [
    "T.W.S. Express Courier",
    "TWS Express"
  ],
  "region": {
    "countries": [
      "IT"
    ]
  },
  "brand": {
    "color": "#FFED00"
  },
  "selectable": true,
  "timezone": "Europe/Rome",
  "tracking": {
    "mode": "automatic",
    "adapter": "tws-express",
    "steps": [
      "direct",
      "retry"
    ],
    "recognition": {
      "rank": 884
    },
    "localClocks": true
  },
  "capabilities": [
    "history",
    "provider_code",
    "eta"
  ],
  "portal": {
    "url": "https://www.mytws.it/tracking-status;ldv={trackingNumber}",
    "searchUrl": "https://twsexpresscourier.it/traccia-spedizione/",
    "canaryUrl": "https://twsexpresscourier.it/traccia-spedizione/",
    "shows": [
      "status",
      "history",
      "parcel_count",
      "customer_reference",
      "order_reference",
      "depot_code",
      "signatory",
      "remarks"
    ],
    "scraped": [
      "status",
      "history",
      "provider_code",
      "eta"
    ],
    "discarded": [
      "parcel_count",
      "customer_reference",
      "order_reference",
      "depot_code",
      "signatory",
      "remarks"
    ],
    "unavailable": [
      "location",
      "weight",
      "service_name",
      "delivered_at",
      "offset_timestamps",
      "delivery_tracking_number"
    ]
  },
  "links": [
    {
      "domains": [
        "mytws.it"
      ],
      "path": "^/tracking-status;ldv=([^/?#;]+)$"
    },
    {
      "domains": [
        "twsexpresscourier.it"
      ],
      "pathPattern": "^/Ricerca\\.aspx$",
      "params": [
        "ldv"
      ]
    }
  ],
  "detection": [
    {
      "id": "tws-express-1",
      "pattern": "^28\\d{4}[A-Z]\\d{6}$",
      "confidence": "low"
    }
  ]
}
